[
  {
    "sample_name": "demo_sample.exe",
    "sample_hash": "demo_sha256_xxxxxxxxxxxxxxxxxxxxxxxxxxxxxxxxxxxxxxxxxxxxxxxxxxxxxxxxxxxxxxxx",
    "platform": "Windows",
    "function_name": "sub_401000",
    "function_addr": "0x401000",
    "pseudo_code": "int __stdcall sub_401000()\n{\n HANDLE hProcess;\n LPVOID remoteMem;\n hProcess = OpenProcess(0x1F0FFF, 0, pid);\n remoteMem = VirtualAllocEx(hProcess, 0, 4096, 0x3000, 0x40);\n WriteProcessMemory(hProcess, remoteMem, shellcode, shellcode_len, 0);\n CreateRemoteThread(hProcess, 0, 0, remoteMem, 0, 0, 0);\n return 0;\n}",
    "api_calls": [
      "OpenProcess",
      "VirtualAllocEx",
      "WriteProcessMemory",
      "CreateRemoteThread"
    ],
    "strings": [
      "explorer.exe",
      "kernel32.dll"
    ],
    "callers": [
      "sub_402000"
    ],
    "callees": [],
    "behavior_tags": [
      "进程注入",
      "远程线程创建"
    ],
    "mapped_attack_ids": [],
    "summary": "该函数通过打开目标进程、申请远程内存、写入数据并创建远程线程，疑似实现进程注入。",
    "keywords": [
      "OpenProcess",
      "VirtualAllocEx",
      "WriteProcessMemory",
      "CreateRemoteThread",
      "explorer.exe",
      "kernel32.dll",
      "进程注入",
      "远程线程创建",
      "sub_401000"
    ]
  },
  {
    "sample_name": "demo_sample.exe",
    "sample_hash": "demo_sha256_xxxxxxxxxxxxxxxxxxxxxxxxxxxxxxxxxxxxxxxxxxxxxxxxxxxxxxxxxxxxxxxx",
    "platform": "Windows",
    "function_name": "sub_402000",
    "function_addr": "0x402000",
    "pseudo_code": "int __stdcall sub_402000()\n{\n HKEY hKey;\n RegOpenKeyEx(HKEY_CURRENT_USER,\n \"Software\\\\Microsoft\\\\Windows\\\\CurrentVersion\\\\Run\",\n 0, KEY_SET_VALUE, &hKey);\n RegSetValueEx(hKey, \"Updater\", 0, REG_SZ, \"C:\\\\Users\\\\Public\\\\svchost.exe\", 30);\n return 0;\n}",
    "api_calls": [
      "RegOpenKeyEx",
      "RegSetValueEx"
    ],
    "strings": [
      "Software\\Microsoft\\Windows\\CurrentVersion\\Run",
      "Updater",
      "C:\\Users\\Public\\svchost.exe"
    ],
    "callers": [],
    "callees": [
      "sub_401000"
    ],
    "behavior_tags": [
      "注册表持久化"
    ],
    "mapped_attack_ids": [],
    "summary": "该函数通过修改注册表启动项写入路径，疑似实现开机自启动持久化。",
    "keywords": [
      "RegOpenKeyEx",
      "RegSetValueEx",
      "Software\\Microsoft\\Windows\\CurrentVersion\\Run",
      "Updater",
      "C:\\Users\\Public\\svchost.exe",
      "注册表持久化",
      "sub_402000"
    ]
  }
]